Saved Search Query,Title,Price,Date,eBay URL
2015 connor mcdavid lot,CONNOR MCDAVID ROOKIE CARD #1 DRAFT LEAF OILERS ITG GEM MINT,40.0,2026-05-27 08:00:33,https://www.ebay.com/itm/206296541750
2015 connor mcdavid lot,CONNOR MCDAVID DRAFT CARD #1 LEAF ITG ROOKIE SPA GEM MINT 10,25.0,2026-05-27 08:00:33,https://www.ebay.com/itm/198376375018
2015 connor mcdavid lot,Upper Deck Connor McDavid Oilers NHL Aimbots/Gaming POV/Let Them Cook Lot (3),4.0,2026-05-27 08:00:34,https://www.ebay.com/itm/168397163966
2015 connor mcdavid lot,2015-16 Upper Deck Connor McDavid UD Star Rookies PSA 9,65.0,2026-05-27 08:00:34,https://www.ebay.com/itm/800054361279
2015 connor mcdavid lot,2015-16 CONNOR MCDAVID Rookie Rc Lot Edmonton Oilers lot of 4,202.72,2026-05-27 08:00:34,https://www.ebay.com/itm/178147980684
2015 connor mcdavid lot,"LOT (20) 2015-16 Upper Deck Connor McDavid Collection (Missing # 4,16,17,21,25)",57.91,2026-05-27 08:00:34,https://www.ebay.com/itm/147312627869
2015 connor mcdavid lot,16 Cards Lot Of Connor Mcdavid Hockey Card,14.42,2026-05-27 08:00:34,https://www.ebay.com/itm/287322502208
2015 connor mcdavid lot,2015-16 Upper Deck Connor McDavid Collection - Connor McDavid #CM-24,4.99,2026-05-27 08:00:34,https://www.ebay.com/itm/318261833834
2015 connor mcdavid lot,2015-16 RC Opc Connor Mcdavid Edmonton Oilers,72.4,2026-05-27 08:00:34,https://www.ebay.com/itm/327125099847
2015 connor mcdavid lot,CONNOR MCDAVID ROOKIE CARD #1 DRAFT LEAF OILERS ITG GEM MINT #10 🏒🔥HOT🔥🏒 !!,39.99,2026-05-27 08:00:34,https://www.ebay.com/itm/198284341573
lemieux lot,NEW LISTINGAVALANCHE LOT OF 3 - 1996-97 UD COLLECTOR’S CHOICE - MVP - ROY FORSBERG LEMIEUX,3.62,2026-05-27 08:00:39,https://www.ebay.com/itm/127887555794
lemieux lot,NEW LISTINGHockey Card Lot Of 76 Cards - Gretzky Lindros Lemieux Etc . Great Starter Lot,0.99,2026-05-27 08:00:40,https://www.ebay.com/itm/800063985818
lemieux lot,"NEW LISTING1988-89 OPC #120 Wayne Gretzky, #1 Mario Lemieux, #181 Bob Probert RC Lot",0.99,2026-05-27 08:00:40,https://www.ebay.com/itm/157936159192
lemieux lot,NEW LISTINGLot 6 Gretzky Lemieux Brodeur Yzerman CGC graded cards 7 8 8.5 NHL HOF,0.01,2026-05-27 08:00:40,https://www.ebay.com/itm/287355500230
lemieux lot,NEW LISTINGMario Lemieux 9 card lot,5.43,2026-05-27 08:00:40,https://www.ebay.com/itm/168405740088
lemieux lot,NEW LISTING1990-91 Pro Set #236 Mario Lemieux 2ct Penguins Hockey Card Lot 2301G,3.0,2026-05-27 08:00:40,https://www.ebay.com/itm/168405576060
lemieux lot,NEW LISTING2010 BLACK DIAMOND TEAM CANADA D/C #TC-ML MARIO LEMIEUX LOT OF 45 MINT H375443,4.99,2026-05-27 08:00:40,https://www.ebay.com/itm/377212698653
lemieux lot,NEW LISTING1988-89 O Pee Chee Hockey 4 Pack Sticker lot - Gretzky Lemieux,5.95,2026-05-27 08:00:41,https://www.ebay.com/itm/278025072524
lemieux lot,1993-94 Leaf Mario Lemieux Collection Lot of 3 #6-7-9,2.16,2026-05-27 08:00:41,https://www.ebay.com/itm/406951797958
lemieux lot,"1991-92 O-Pee-Chee/Topps NHL Hockey - Lot Of 12 Cards - Gretzky, Lemieux, More",0.99,2026-05-27 08:00:41,https://www.ebay.com/itm/137345378607
gretzky lot,NEW LISTINGold sports cards lot《Stars/Goats》《Wilt▪︎Aaron ▪︎Ohtani▪︎Brady▪︎Mantle▪︎Gretzky 》,4.55,2026-05-27 08:00:45,https://www.ebay.com/itm/358603815428
gretzky lot,"NEW LISTING1982-83 OPC Grant Fuhr, Ron Francis RC, 84-85 Pat LaFontaine RC, Gretzky Lot",34.95,2026-05-27 08:00:45,https://www.ebay.com/itm/318367059582
gretzky lot,NEW LISTING1979-80 Topps Hockey Lot of 132 Cards w/ Duplicates All Crease Free,49.95,2026-05-27 08:00:45,https://www.ebay.com/itm/377213701407
gretzky lot,NEW LISTING(3) 1990 Topps WAYNE GRETZKY LOT *Kings Oilers* Wayne Gretzky Topps Lot x 3,0.5,2026-05-27 08:00:45,https://www.ebay.com/itm/147332798917
gretzky lot,NEW LISTINGHockey NHL Star Lot (6) Marian Hossa Fernandez Roenick Bondra Allison & Belfour,4.99,2026-05-27 08:00:46,https://www.ebay.com/itm/406954300525
gretzky lot,NEW LISTINGHockey Card Lot Of 76 Cards - Gretzky Lindros Lemieux Etc . Great Starter Lot,0.99,2026-05-27 08:00:46,https://www.ebay.com/itm/800063985818
gretzky lot,"NEW LISTING1980-81 OPC/Topps #182 Wayne Gretzky Leaders, OPC #344 Rod Langway RC Lot",0.99,2026-05-27 08:00:46,https://www.ebay.com/itm/157936161611
gretzky lot,"NEW LISTING1988-89 OPC #120 Wayne Gretzky, #1 Mario Lemieux, #181 Bob Probert RC Lot",0.99,2026-05-27 08:00:46,https://www.ebay.com/itm/157936159192
gretzky lot,"NEW LISTING2025-26 O-Pee-Chee Platinum Pink Magma Gudas,Byfield 3 Cards Lot FCXZK",0.99,2026-05-27 08:00:46,https://www.ebay.com/itm/800067039222
gretzky lot,NEW LISTING1990s NHL Hockey 4000-Card Lot Sorted By Player Gretzky Jagr Lemeiux Hull,477.01,2026-05-27 08:00:46,https://www.ebay.com/itm/188428912734
hockey hobby box,NEW LISTING2019-20 Upper Deck Series 1 Hockey Hobby Box New Sealed RC Rookie Auto,0.99,2026-05-27 08:00:52,https://www.ebay.com/itm/800075125037
hockey hobby box,NEW LISTING2020-21 Upper Deck Series 1 Hockey Hobby Box Factory Sealed New RC Rookie Auto,0.99,2026-05-27 08:00:52,https://www.ebay.com/itm/800076104468
hockey hobby box,NEW LISTING2019-20 Upper Deck Hockey Allure Hobby Box Factory Sealed New RC Rookie Auto,3.25,2026-05-27 08:00:52,https://www.ebay.com/itm/800076111861
hockey hobby box,NEW LISTING2025-26 Upper Deck O-Pee-Chee Platinum Hockey Hobby Box - Brand New Sealed,15.5,2026-05-27 08:00:52,https://www.ebay.com/itm/117217087577
hockey hobby box,"NEW LISTING2025-26 Upper Deck O-Pee-Chee OPC Platinum Hockey Hobby Box - 1 Auto, Schaefer?",354.39,2026-05-27 08:00:52,https://www.ebay.com/itm/327180083274
hockey hobby box,NEW LISTING24/25 UPPER DECK CREDENTIALS HOCKEY FACTORY SEALED HOBBY BOX - CELEBRINI RC YEAR,173.73,2026-05-27 08:00:52,https://www.ebay.com/itm/127887120155
hockey hobby box,NEW LISTING2018-19 UPPER DECK THE CUP HOCKEY HOBBY BOX FACTORY SEALED,0.99,2026-05-27 08:00:52,https://www.ebay.com/itm/366435988189
hockey hobby box,NEW LISTING2022/23 Upper Deck Series 1 Hockey Factory Sealed HOBBY Box-192 Card-6 YOUNG GUN,67.95,2026-05-27 08:00:53,https://www.ebay.com/itm/366436195082
hockey hobby box,NEW LISTING2022-23 Upper Deck MVP NHL Hockey Hobby Box Factory Sealed 20 Packs 160 Cards,31.89,2026-05-27 08:00:53,https://www.ebay.com/itm/127886824654
hockey hobby box,NEW LISTING2023-24 Upper Deck Artifacts Hockey Hobby Box,175.95,2026-05-27 08:00:53,https://www.ebay.com/itm/366435893184
rc lot,NEW LISTING2025-26 Topps - VJ Edgecombe #203 (RC),0.99,2026-05-27 08:00:58,https://www.ebay.com/itm/227348149293
rc lot,NEW LISTING2025 Panini Prizm WNBA - Groovy Hailey Van Lith #14 (RC),2.1,2026-05-27 08:00:58,https://www.ebay.com/itm/287355795778
rc lot,NEW LISTING2025 Panini Prizm WNBA - Fireworks Sonia Citron #15 (RC),2.0,2026-05-27 08:00:58,https://www.ebay.com/itm/287355795780
rc lot,NEW LISTING2025 Panini Select - Select Certified Rookies Dillon Gabriel #11 (RC),1.99,2026-05-27 08:00:58,https://www.ebay.com/itm/298355875305
rc lot,NEW LISTINGLot of 50 RC73L2C222JTF SMEC Chip Resistor 2.2K Ohm 100mW 1/10W 5% 0603 SMT NOS,5.75,2026-05-27 08:00:58,https://www.ebay.com/itm/236840597216
rc lot,NEW LISTINGEury Perez 3 Card Lot (RC Included)- Miami Marlins,5.0,2026-05-27 08:00:59,https://www.ebay.com/itm/406955179320
rc lot,NEW LISTING2025 Panini Rookies & Stars - Crusade TreVeyon Henderson #19 Red Plaid (RC),3.0,2026-05-27 08:00:59,https://www.ebay.com/itm/236840593380
rc lot,NEW LISTING3.9K Ohm 1/2 Watt 5% Carbon Film Resistor (100 Piece Lot) 293-3.9K-RC,11.51,2026-05-27 08:00:59,https://www.ebay.com/itm/236840592191
rc lot,NEW LISTING1951 Bowman MLB Lot of 2 Pittsburgh Pirates in EX-EXMINT - Chambers & Queen(RC),36.2,2026-05-27 08:00:59,https://www.ebay.com/itm/327180895312
rc lot,NEW LISTINGTopps 2026 Jonah Tong New York Mets RC Bowman & Topps Chrome 3-Card Lot,12.0,2026-05-27 08:00:59,https://www.ebay.com/itm/366437399139
gma,NEW LISTINGJackson Holiday GMA 10 Future Stars 2023,25.0,2026-05-27 08:01:04,https://www.ebay.com/itm/800078607467
gma,NEW LISTING2017 Panini Donruss Optic FOOTBALL. Mitchell Trubisky ROOKIE RC PSA 9 & GMA 10,25.99,2026-05-27 08:01:04,https://www.ebay.com/itm/188430673267
gma,NEW LISTING2012 Topps Golden Moments Drew Storen #GMA-DST Auto 0o9,3.68,2026-05-27 08:01:04,https://www.ebay.com/itm/336604789621
gma,NEW LISTING2012 Topps Golden Moments Chris Coghlan (Key Coghlan) #GMA-CC Auto 0t2,6.57,2026-05-27 08:01:05,https://www.ebay.com/itm/336604672192
gma,NEW LISTING2012 Topps Golden Moments Rickie Weeks #GMA-RW Auto 0t2,9.43,2026-05-27 08:01:05,https://www.ebay.com/itm/336604671666
gma,NEW LISTING2012 Topps Golden Moments Johnny Cueto #GMA-JC Auto 0t2,10.94,2026-05-27 08:01:05,https://www.ebay.com/itm/257529883153
gma,NEW LISTING2012 Topps Golden Moments Marlon Byrd #GMA-MABY Auto 0n2,3.59,2026-05-27 08:01:05,https://www.ebay.com/itm/257529683426
gma,NEW LISTINGDJ Uiagalelei 2020 Leaf Army All American - Clemson Tigers GMA 10 Gem Mint💎,50.0,2026-05-27 08:01:05,https://www.ebay.com/itm/137349730913
gma,NEW LISTINGPanini 2025 Donruss Tyler Warren Colts Bomb Squad Rookie #BS-TWN GMA 10,10.0,2026-05-27 08:01:05,https://www.ebay.com/itm/318367640714
gma,NEW LISTINGMosaic 2019 Anthony Davis Got Game? #6 Lakers GMA 10 Gem Mint Basketball Card,20.0,2026-05-27 08:01:05,https://www.ebay.com/itm/278026671603
